{
  "format": "jobhound-monitor",
  "schema_version": 1,
  "id": "game-freak",
  "company_id": "game-freak",
  "revision": 1,
  "label": "Game Freak careers",
  "careers_url": "https://hrmos.co/pages/gamefreak/jobs",
  "compatibility": {
    "min_jobhound_version": "0.1.0",
    "recipe_schema_version": 1
  },
  "verification": {
    "status": "verified",
    "checked_at": "2026-09-05T14:20:04.580826+00:00",
    "job_count": 60,
    "warnings": []
  },
  "recipe": {
    "version": 1,
    "company": "Game Freak",
    "careers_url": "https://hrmos.co/pages/gamefreak/jobs",
    "strategy": "generic_html",
    "allowed_hosts": [
      "hrmos.co"
    ],
    "request": {
      "url": "https://hrmos.co/pages/gamefreak/jobs",
      "method": "GET",
      "headers": {},
      "params": {},
      "json_body": null,
      "timeout_seconds": 15.0,
      "max_response_bytes": 5000000
    },
    "pagination": {
      "kind": "none",
      "parameter": null,
      "page_size_parameter": null,
      "page_size": 100,
      "max_pages": 10,
      "next_path": null
    },
    "source_filter": null,
    "selectors": {
      "item": "li.pg-list-cassette",
      "title": "h2",
      "link": "a[href]",
      "location": ".sg-tag-location",
      "description": ".pg-list-cassette-body"
    },
    "mapping": {},
    "metadata": {}
  }
}
