{
  "format": "jobhound-monitor",
  "schema_version": 1,
  "id": "moody-s",
  "company_id": "moody-s",
  "revision": 1,
  "label": "Moody's Careers",
  "careers_url": "https://careers.moodys.com/en/search-jobs",
  "compatibility": {
    "min_jobhound_version": "0.1.0",
    "recipe_schema_version": 1
  },
  "verification": {
    "status": "verified",
    "checked_at": "2026-09-30T16:28:05.145550+00:00",
    "job_count": 15,
    "warnings": [
      "description detail enrichment skipped 10 jobs after the configured 5-posting limit",
      "Bounded/partial listing; unseen jobs must not be closed from this run."
    ]
  },
  "recipe": {
    "version": 1,
    "company": "Moody's",
    "careers_url": "https://careers.moodys.com/en/search-jobs",
    "strategy": "generic_html",
    "allowed_hosts": [
      "careers.moodys.com"
    ],
    "request": {
      "url": "https://careers.moodys.com/en/search-jobs",
      "method": "GET",
      "headers": {},
      "params": {},
      "json_body": null,
      "timeout_seconds": 15.0,
      "max_response_bytes": 5000000
    },
    "pagination": {
      "kind": "none",
      "parameter": null,
      "page_size_parameter": null,
      "page_size": 20,
      "max_pages": 1,
      "next_path": null
    },
    "source_filter": null,
    "selectors": {
      "item": ".search-results-list__item",
      "title": ".search-results-list__job-title",
      "link": "a[data-job-id]",
      "location": ".search-results-list__job-location"
    },
    "mapping": {},
    "metadata": {
      "partial_listing": true,
      "detail_fetch_limit": 5
    }
  }
}
