{
  "format": "jobhound-monitor",
  "schema_version": 1,
  "id": "bulkhead",
  "company_id": "bulkhead",
  "revision": 1,
  "label": "BULKHEAD careers",
  "careers_url": "https://careers.bulkhead.com/jobs",
  "compatibility": {
    "min_jobhound_version": "0.1.0",
    "recipe_schema_version": 1
  },
  "verification": {
    "status": "verified",
    "checked_at": "2026-09-05T14:20:02.464529+00:00",
    "job_count": 6,
    "warnings": []
  },
  "recipe": {
    "version": 1,
    "company": "BULKHEAD",
    "careers_url": "https://careers.bulkhead.com/jobs",
    "strategy": "generic_json",
    "allowed_hosts": [
      "careers.bulkhead.com"
    ],
    "request": {
      "url": "https://careers.bulkhead.com/jobs.json",
      "method": "GET",
      "headers": {},
      "params": {},
      "json_body": null,
      "timeout_seconds": 15.0,
      "max_response_bytes": 20000000
    },
    "pagination": {
      "kind": "none",
      "parameter": null,
      "page_size_parameter": null,
      "page_size": 100,
      "max_pages": 10,
      "next_path": null
    },
    "source_filter": null,
    "selectors": {},
    "mapping": {
      "items": "items",
      "source_id": "id",
      "title": "title",
      "url": "url",
      "description": "content_html",
      "location": "_jobposting.jobLocation.0.address.addressLocality",
      "employment_type": "_jobposting.employmentType",
      "posted_date": "date_published"
    },
    "metadata": {
      "platform": "teamtailor-jsonfeed",
      "location_note": "Primary city; descriptions preserve other locations."
    }
  }
}
