{
  "format": "jobhound-monitor",
  "schema_version": 1,
  "id": "wildcard",
  "company_id": "wildcard",
  "revision": 1,
  "label": "Studio Wildcard careers",
  "careers_url": "https://studiowildcard.bamboohr.com/careers/.",
  "compatibility": {
    "min_jobhound_version": "0.1.0",
    "recipe_schema_version": 1
  },
  "verification": {
    "status": "verified",
    "checked_at": "2026-09-05T14:20:12.755517+00:00",
    "job_count": 6,
    "warnings": []
  },
  "recipe": {
    "version": 1,
    "company": "Studio Wildcard",
    "careers_url": "https://studiowildcard.bamboohr.com/careers/.",
    "strategy": "generic_json",
    "allowed_hosts": [
      "studiowildcard.bamboohr.com"
    ],
    "request": {
      "url": "https://studiowildcard.bamboohr.com/careers/list",
      "method": "GET",
      "headers": {},
      "params": {},
      "json_body": null,
      "timeout_seconds": 15.0,
      "max_response_bytes": 20000000
    },
    "pagination": {
      "kind": "none",
      "parameter": null,
      "page_size_parameter": null,
      "page_size": 100,
      "max_pages": 10,
      "next_path": null
    },
    "source_filter": null,
    "selectors": {},
    "mapping": {
      "items": "result",
      "source_id": "id",
      "title": "jobOpeningName",
      "url": "id",
      "location": "location.city",
      "employment_type": "employmentStatusLabel"
    },
    "metadata": {
      "platform": "bamboohr",
      "description_note": "Listing lacks descriptions; source links have full details."
    }
  }
}
