{
  "format": "jobhound-monitor",
  "schema_version": 1,
  "id": "riot-games",
  "company_id": "riot-games",
  "revision": 1,
  "label": "Riot Games careers",
  "careers_url": "https://www.riotgames.com/en/work-with-us/jobs",
  "compatibility": {
    "min_jobhound_version": "0.1.0",
    "recipe_schema_version": 1
  },
  "verification": {
    "status": "verified",
    "checked_at": "2026-09-04T11:51:38.690927+00:00",
    "job_count": 161,
    "warnings": []
  },
  "recipe": {
    "version": 1,
    "company": "Riot Games",
    "careers_url": "https://www.riotgames.com/en/work-with-us/jobs",
    "strategy": "greenhouse",
    "allowed_hosts": [
      "job-boards.greenhouse.io",
      "boards-api.greenhouse.io",
      "www.riotgames.com"
    ],
    "request": {
      "url": "https://boards-api.greenhouse.io/v1/boards/riotgames/jobs",
      "method": "GET",
      "headers": {},
      "params": {
        "content": true
      },
      "json_body": null,
      "timeout_seconds": 15.0,
      "max_response_bytes": 20000000
    },
    "pagination": {
      "kind": "none",
      "parameter": null,
      "page_size_parameter": null,
      "page_size": 100,
      "max_pages": 10,
      "next_path": null
    },
    "source_filter": null,
    "selectors": {},
    "mapping": {},
    "metadata": {
      "board_token": "riotgames"
    }
  }
}
