{
  "format": "jobhound-monitor",
  "schema_version": 1,
  "id": "intercontinental-exchange",
  "company_id": "intercontinental-exchange",
  "revision": 1,
  "label": "Intercontinental Exchange Careers",
  "careers_url": "https://careers.ice.com/jobs",
  "compatibility": {
    "min_jobhound_version": "0.1.0",
    "recipe_schema_version": 1
  },
  "verification": {
    "status": "verified",
    "checked_at": "2026-09-24T02:04:49.259312+00:00",
    "job_count": 10,
    "warnings": [
      "Bounded/partial listing; unseen jobs must not be closed from this run."
    ]
  },
  "recipe": {
    "version": 1,
    "company": "Intercontinental Exchange",
    "careers_url": "https://careers.ice.com/jobs",
    "strategy": "generic_json",
    "allowed_hosts": [
      "careers.ice.com"
    ],
    "request": {
      "url": "https://careers.ice.com/api/jobs",
      "method": "GET",
      "headers": {},
      "params": {},
      "json_body": null,
      "timeout_seconds": 15,
      "max_response_bytes": 5000000
    },
    "pagination": {
      "kind": "none",
      "parameter": null,
      "page_size_parameter": null,
      "page_size": 10,
      "max_pages": 1,
      "next_path": null
    },
    "selectors": {},
    "mapping": {
      "items": "jobs",
      "source_id": "data.req_id",
      "title": "data.title",
      "location": "data.location_name",
      "url": "data.apply_url",
      "description": "data.description",
      "posted_date": "data.posted_date",
      "employment_type": "data.employment_type"
    },
    "source_filter": null,
    "metadata": {
      "partial_listing": true
    }
  }
}
