{
  "format": "jobhound-monitor",
  "schema_version": 1,
  "id": "freeport-mcmoran",
  "company_id": "freeport-mcmoran",
  "revision": 1,
  "label": "Freeport-McMoRan Careers",
  "careers_url": "https://jobs.fcx.com/search",
  "compatibility": {
    "min_jobhound_version": "0.1.0",
    "recipe_schema_version": 1
  },
  "verification": {
    "status": "verified",
    "checked_at": "2026-09-07T06:58:10.180359+00:00",
    "job_count": 25,
    "warnings": [
      "Bounded/partial listing; unseen jobs must not be closed from this run."
    ]
  },
  "recipe": {
    "version": 1,
    "company": "Freeport-McMoRan",
    "careers_url": "https://jobs.fcx.com/search",
    "strategy": "generic_html",
    "allowed_hosts": [
      "jobs.fcx.com"
    ],
    "request": {
      "url": "https://jobs.fcx.com/search/",
      "method": "GET",
      "headers": {},
      "params": {},
      "json_body": null,
      "timeout_seconds": 15.0,
      "max_response_bytes": 5000000
    },
    "pagination": {
      "kind": "none",
      "parameter": null,
      "page_size_parameter": null,
      "page_size": 100,
      "max_pages": 10,
      "next_path": null
    },
    "source_filter": null,
    "selectors": {
      "item": ".job-row .sub-section-desktop",
      "title": "a.jobTitle-link",
      "link": "a.jobTitle-link",
      "location": ".section-field.location > div"
    },
    "mapping": {},
    "metadata": {
      "partial_listing": true
    }
  }
}
