{
  "format": "jobhound-monitor",
  "schema_version": 1,
  "id": "general-dynamics",
  "company_id": "general-dynamics",
  "revision": 1,
  "label": "General Dynamics Careers",
  "careers_url": "https://www.gd.com/careers/job-search",
  "compatibility": {
    "min_jobhound_version": "0.1.0",
    "recipe_schema_version": 1
  },
  "verification": {
    "status": "verified",
    "checked_at": "2026-09-04T18:37:00.360923+00:00",
    "job_count": 50,
    "warnings": [
      "Bounded/partial listing; unseen jobs must not be closed from this run."
    ]
  },
  "recipe": {
    "version": 1,
    "company": "General Dynamics",
    "careers_url": "https://www.gd.com/careers/job-search",
    "strategy": "generic_html",
    "allowed_hosts": [
      "www.gd.com",
      "careers-gdeb.icims.com"
    ],
    "request": {
      "url": "https://careers-gdeb.icims.com/jobs/search?ss=1&in_iframe=1",
      "method": "GET",
      "headers": {},
      "params": {},
      "json_body": null,
      "timeout_seconds": 30.0,
      "max_response_bytes": 5000000
    },
    "pagination": {
      "kind": "none",
      "parameter": null,
      "page_size_parameter": null,
      "page_size": 100,
      "max_pages": 10,
      "next_path": null
    },
    "source_filter": null,
    "selectors": {
      "item": ".iCIMS_JobCardItem",
      "title": ".title h3",
      "link": ".title a",
      "location": ".iCIMS_JobHeaderTag:nth-child(3) dd",
      "description": ".description"
    },
    "mapping": {},
    "metadata": {
      "partial_listing": true,
      "business_unit": "General Dynamics Electric Boat"
    }
  }
}
