{
  "format": "jobhound-monitor",
  "schema_version": 1,
  "id": "teledyne",
  "company_id": "teledyne",
  "revision": 1,
  "label": "Teledyne Technologies careers",
  "careers_url": "https://flir.wd1.myworkdayjobs.com/flircareers",
  "compatibility": {
    "min_jobhound_version": "0.1.0",
    "recipe_schema_version": 1
  },
  "verification": {
    "status": "verified",
    "checked_at": "2026-10-08T17:33:33.968505+00:00",
    "job_count": 752,
    "warnings": [
      "Listing is incomplete; unseen roles are not confirmed closed.",
      "Description traversal paused; 430 eligible roles resume next run.",
      "Resuming metadata or descriptions from a prior listing snapshot; this is not a new absence check."
    ]
  },
  "recipe": {
    "version": 1,
    "coverage_mode": "all",
    "company": "Teledyne Technologies",
    "careers_url": "https://flir.wd1.myworkdayjobs.com/flircareers",
    "strategy": "workday",
    "allowed_hosts": [
      "flir.wd1.myworkdayjobs.com"
    ],
    "request": {
      "url": "https://flir.wd1.myworkdayjobs.com/wday/cxs/flir/flircareers/jobs",
      "method": "POST",
      "headers": {},
      "params": {},
      "json_body": {
        "appliedFacets": {},
        "limit": 20,
        "offset": 0,
        "searchText": ""
      },
      "timeout_seconds": 25,
      "max_response_bytes": 20000000
    },
    "pagination": {
      "kind": "offset",
      "parameter": "offset",
      "page_size_parameter": "limit",
      "page_size": 20,
      "max_pages": null,
      "next_path": null
    },
    "selectors": {},
    "mapping": {},
    "metadata": {
      "tenant": "flir",
      "site": "flircareers"
    }
  }
}
