{
  "format": "jobhound-monitor",
  "schema_version": 1,
  "id": "expand-energy",
  "company_id": "expand-energy",
  "revision": 1,
  "label": "Expand Energy Careers",
  "careers_url": "https://jobs.expandenergy.com/search",
  "compatibility": {
    "min_jobhound_version": "0.1.0",
    "recipe_schema_version": 1
  },
  "verification": {
    "status": "verified",
    "checked_at": "2026-09-24T03:06:24.817411+00:00",
    "job_count": 25,
    "warnings": [
      "Bounded/partial listing; unseen jobs must not be closed from this run."
    ]
  },
  "recipe": {
    "version": 1,
    "company": "Expand Energy",
    "careers_url": "https://jobs.expandenergy.com/search",
    "strategy": "generic_html",
    "allowed_hosts": [
      "jobs.expandenergy.com"
    ],
    "request": {
      "url": "https://jobs.expandenergy.com/search/",
      "method": "GET",
      "headers": {},
      "params": {},
      "json_body": null,
      "timeout_seconds": 20,
      "max_response_bytes": 5000000
    },
    "pagination": {
      "kind": "none",
      "parameter": null,
      "page_size_parameter": null,
      "page_size": 25,
      "max_pages": 1,
      "next_path": null
    },
    "source_filter": null,
    "selectors": {
      "item": "tr.data-row:has(a.jobTitle-link[href*=\"/job/\"])",
      "title": ".jobTitle.hidden-phone a.jobTitle-link",
      "link": ".jobTitle.hidden-phone a.jobTitle-link",
      "location": ".colLocation.hidden-phone .jobLocation"
    },
    "mapping": {},
    "metadata": {
      "partial_listing": true
    }
  }
}
