{
  "format": "jobhound-monitor",
  "schema_version": 1,
  "id": "delek-us-holdings",
  "company_id": "delek-us-holdings",
  "revision": 1,
  "label": "Delek US Holdings Careers",
  "careers_url": "https://jobs.delekus.com/search",
  "compatibility": {
    "min_jobhound_version": "0.1.0",
    "recipe_schema_version": 1
  },
  "verification": {
    "status": "verified",
    "checked_at": "2026-09-30T16:27:55.348145+00:00",
    "job_count": 25,
    "warnings": [
      "description detail enrichment skipped 20 jobs after the configured 5-posting limit",
      "description detail enrichment was incomplete for 5 jobs",
      "Bounded/partial listing; unseen jobs must not be closed from this run."
    ]
  },
  "recipe": {
    "version": 1,
    "company": "Delek US Holdings",
    "careers_url": "https://jobs.delekus.com/search",
    "strategy": "generic_html",
    "allowed_hosts": [
      "jobs.delekus.com"
    ],
    "request": {
      "url": "https://jobs.delekus.com/search/",
      "method": "GET",
      "headers": {},
      "params": {},
      "json_body": null,
      "timeout_seconds": 15.0,
      "max_response_bytes": 5000000
    },
    "pagination": {
      "kind": "none",
      "parameter": null,
      "page_size_parameter": null,
      "page_size": 20,
      "max_pages": 1,
      "next_path": null
    },
    "source_filter": null,
    "selectors": {
      "item": "tr.data-row",
      "title": "a.jobTitle-link",
      "link": "a.jobTitle-link",
      "location": "span.jobLocation"
    },
    "mapping": {},
    "metadata": {
      "partial_listing": true,
      "detail_fetch_limit": 5
    }
  }
}
