{
  "format": "jobhound-monitor",
  "schema_version": 1,
  "id": "estee-lauder",
  "company_id": "estee-lauder",
  "revision": 1,
  "label": "Estée Lauder Careers",
  "careers_url": "https://careers.elcompanies.com/careers",
  "compatibility": {
    "min_jobhound_version": "0.1.0",
    "recipe_schema_version": 1
  },
  "verification": {
    "status": "verified",
    "checked_at": "2026-09-24T00:41:50.187940+00:00",
    "job_count": 10,
    "warnings": [
      "Bounded/partial listing; unseen jobs must not be closed from this run."
    ]
  },
  "recipe": {
    "version": 1,
    "company": "Estée Lauder",
    "careers_url": "https://careers.elcompanies.com/careers",
    "strategy": "playwright",
    "allowed_hosts": [
      "careers.elcompanies.com",
      "static.vscdn.net",
      "media.elcompanies.com",
      "code.jquery.com",
      "fonts.googleapis.com",
      "fonts.gstatic.com",
      "www.gstatic.com",
      "www.recaptcha.net"
    ],
    "request": {
      "url": "https://careers.elcompanies.com/careers",
      "method": "GET",
      "timeout_seconds": 30,
      "max_response_bytes": 5000000,
      "headers": {},
      "params": {},
      "json_body": null
    },
    "pagination": {
      "kind": "none",
      "max_pages": 1,
      "parameter": null,
      "page_size_parameter": null,
      "page_size": 10,
      "next_path": null
    },
    "selectors": {
      "item": "div[data-test-id='job-listing']",
      "title": "[class^='title-']",
      "link": "a[href*='/careers/job/']",
      "location": "[class^='fieldValue-']"
    },
    "metadata": {
      "wait_selector": "div[data-test-id='job-listing']",
      "partial_listing": true
    },
    "mapping": {},
    "source_filter": null
  }
}
