{
  "format": "jobhound-monitor",
  "schema_version": 1,
  "id": "valero",
  "company_id": "valero",
  "revision": 1,
  "label": "Valero Featured U.S. Roles",
  "careers_url": "https://www.valero.com/careers/apply-join-us",
  "compatibility": {
    "min_jobhound_version": "0.1.0",
    "recipe_schema_version": 1
  },
  "verification": {
    "status": "verified",
    "checked_at": "2026-09-04T05:39:57.938991+00:00",
    "job_count": 6,
    "warnings": [
      "Bounded/partial listing; unseen jobs must not be closed from this run.",
      "Six featured U.S. roles linked by the corporate careers page; not the complete Taleo inventory."
    ]
  },
  "recipe": {
    "version": 1,
    "company": "Valero Energy",
    "careers_url": "https://www.valero.com/careers/apply-join-us",
    "strategy": "generic_html",
    "allowed_hosts": [
      "www.valero.com"
    ],
    "request": {
      "url": "https://www.valero.com/careers/apply-join-us",
      "method": "GET",
      "headers": {},
      "params": {},
      "json_body": null,
      "timeout_seconds": 15.0,
      "max_response_bytes": 5000000
    },
    "pagination": {
      "kind": "none",
      "parameter": null,
      "page_size_parameter": null,
      "page_size": 100,
      "max_pages": 10,
      "next_path": null
    },
    "source_filter": null,
    "selectors": {
      "item": ".link-item",
      "title": "a[href*=\"jobdetail\"]",
      "link": "a[href*=\"jobdetail\"]"
    },
    "mapping": {},
    "metadata": {
      "partial_listing": true
    }
  }
}
