{
  "format": "jobhound-monitor",
  "schema_version": 1,
  "id": "xebia-benelux",
  "company_id": "xebia",
  "revision": 2,
  "label": "Xebia Benelux careers",
  "careers_url": "https://xebiacareers.recruitee.com/",
  "compatibility": {
    "min_jobhound_version": "0.1.0",
    "recipe_schema_version": 1
  },
  "verification": {
    "status": "unverified",
    "checked_at": null,
    "job_count": null,
    "warnings": [
      "Requires the updated all-role traversal runtime; awaiting trusted upstream validation."
    ]
  },
  "recipe": {
    "version": 1,
    "company": "Xebia",
    "careers_url": "https://xebiacareers.recruitee.com/",
    "strategy": "generic_json",
    "allowed_hosts": [
      "xebiacareers.recruitee.com"
    ],
    "request": {
      "url": "https://xebiacareers.recruitee.com/api/offers",
      "method": "GET",
      "headers": {},
      "params": {},
      "json_body": null,
      "timeout_seconds": 25,
      "max_response_bytes": 20000000
    },
    "pagination": {
      "kind": "none",
      "parameter": null,
      "page_size_parameter": null,
      "page_size": 100,
      "max_pages": null,
      "next_path": null
    },
    "selectors": {},
    "mapping": {
      "items": "offers",
      "source_id": "id",
      "title": "title",
      "location": "location",
      "url": "careers_url",
      "description": "description",
      "posted_date": "published_at",
      "employment_type": "employment_type_code"
    },
    "metadata": {},
    "coverage_mode": "all"
  }
}
