{
  "format": "jobhound-monitor",
  "schema_version": 1,
  "id": "us-bank",
  "company_id": "us-bank",
  "revision": 1,
  "label": "U.S. Bancorp Careers",
  "careers_url": "https://usbank.wd1.myworkdayjobs.com/US_Bank_Careers",
  "compatibility": {
    "min_jobhound_version": "0.1.0",
    "recipe_schema_version": 1
  },
  "verification": {
    "status": "verified",
    "checked_at": "2026-09-06T05:01:44.960777+00:00",
    "job_count": 200,
    "warnings": [
      "description detail enrichment skipped 195 jobs after the configured 5-posting limit",
      "Bounded/partial listing; unseen jobs must not be closed from this run."
    ]
  },
  "recipe": {
    "version": 1,
    "company": "U.S. Bancorp",
    "careers_url": "https://usbank.wd1.myworkdayjobs.com/US_Bank_Careers",
    "strategy": "workday",
    "allowed_hosts": [
      "usbank.wd1.myworkdayjobs.com"
    ],
    "request": {
      "url": "https://usbank.wd1.myworkdayjobs.com/wday/cxs/usbank/US_Bank_Careers/jobs",
      "method": "POST",
      "headers": {},
      "params": {},
      "json_body": {
        "appliedFacets": {},
        "limit": 20,
        "offset": 0,
        "searchText": ""
      },
      "timeout_seconds": 15.0,
      "max_response_bytes": 5000000
    },
    "pagination": {
      "kind": "offset",
      "parameter": "offset",
      "page_size_parameter": "limit",
      "page_size": 20,
      "max_pages": 10,
      "next_path": null
    },
    "source_filter": null,
    "selectors": {},
    "mapping": {},
    "metadata": {
      "tenant": "usbank",
      "site": "US_Bank_Careers",
      "detail_fetch_limit": 5,
      "partial_listing": true
    }
  }
}
